{
  "drugType": "compoundprescription",
  "compoundprescriptionText": "Drug nÂ°13",
  "beginmoment": "2021-07-15",
  "periodicity": "M",
  "temporality": "chronic",
  "medicationuse": "Regimen posology with frequency - per given day of the month",
  "regimen": [
    {
      "quantity": 1.0,
      "timeOfDay": {
        "dayPeriod": "afterdinner"
      },
      "dayIngestion": {
        "dayNumber": 15
      }
    }
  ]
}
