{
  "drugType": "compoundprescription",
  "compoundprescriptionText": "Drug nÂ°5",
  "beginmoment": "2021-03-22",
  "regimen": [
    {
      "quantity": 2,
      "timeOfDay": {
        "time": "07:59:00"
      }
    }
  ],
  "medicationuse": "Regimen posology without frequency (2 at 7:59) - only displayed the 22nd maart 2021"
}
