{
  "drugType": "compoundprescription",
  "compoundprescriptionText": "Drug nÂ°7",
  "beginmoment": "2021-03-22",
  "regimen": [
    {
      "quantity": 2,
      "timeOfDay": {
        "dayPeriod": "beforebreakfast"
      },
      "unit": "00001",
      "dayIngestion": {
        "date": "2023-02-01"
      }
    }
  ],
  "medicationuse": "Regimen posology without frequency (2 teaspoon (5 ml) ) - only displayed the 1st februari 2023"
}
