{
  "drugType": "compoundprescription",
  "compoundprescriptionText": "Drug nÂ°8",
  "beginmoment": "2021-03-22",
  "regimen": [
    {
      "quantity": 2,
      "timeOfDay": {
        "dayPeriod": "beforebreakfast"
      },
      "unit": "00001",
      "dayIngestion": {
        "dayNumber": 1
      }
    },
    {
      "quantity": 2,
      "timeOfDay": {
        "dayPeriod": "beforebreakfast"
      },
      "unit": "00001",
      "dayIngestion": {
        "dayNumber": 2
      }
    }
  ],
  "medicationuse": "Regimen posology without frequency (2 teaspoon (5 ml) ) - only displayed the 22nd / 23nd maart 2021"
}
