{
  "drugType": "compoundprescription",
  "compoundprescriptionText": "Drug nÂ°12",
  "beginmoment": "2021-07-22",
  "periodicity": "J",
  "temporality": "chronic",
  "regimen": [
    {
      "quantity": 1.0,
      "timeOfDay": {
        "dayPeriod": "morning"
      },
      "dayIngestion": {
        "date": "2042-07-22"
      }
    }
  ],
  "medicationuse": "Regimen posology with frequency - per year at given date"
}
