{
  "drugType": "compoundprescription",
  "compoundprescriptionText": "Drug nÂ°4",
  "beginmoment": "2021-03-22",
  "regimen": [
    {
      "quantity": 2,
      "timeOfDay": {
        "dayPeriod": "afterlunch"
      }
    }
  ],
  "medicationuse": "Regimen posology without frequency (2 in the afterlunch) - only displayed the 22nd maart 2021"
}
