{
  "drugType": "compoundprescription",
  "compoundprescriptionText": "Drug nÂ°6",
  "posologyFreeText": "Free text posology",
  "beginmoment": "2021-03-22",
  "endmoment": "2021-03-22",
  "medicationuse": "Free text without periodicity / temporality but with endDate - only displayed the 22nd maart 2021"
}
