{
  "drugType": "compoundprescription",
  "compoundprescriptionText": "Drug nÂ°9",
  "beginmoment": "2021-03-22",
  "regimen": [
    {
      "quantity": 2,
      "timeOfDay": {
        "dayPeriod": "beforebreakfast"
      },
      "dayIngestion": {
        "weekday": "friday"
      }
    }
  ],
  "medicationuse": "Regimen posology without frequency (2 teaspoon (5 ml) ) - only displayed the 26nd maart 2021 (Friday)"
}
