{
  "drugType": "compoundprescription",
  "compoundprescriptionText": "Drug nÂ°10",
  "beginmoment": "2021-03-22",
  "periodicity": "D",
  "temporality": "chronic",
  "regimen": [
    {
      "quantity": 1,
      "timeOfDay": {
        "time": "05:59:00"
      }
    },
    {
      "quantity": 1,
      "timeOfDay": {
        "time": "07:30:00"
      }
    },
    {
      "quantity": 1,
      "timeOfDay": {
        "time": "13:30:00"
      }
    },
    {
      "quantity": 1,
      "timeOfDay": {
        "time": "19:30:00"
      }
    },
    {
      "quantity": 1,
      "timeOfDay": {
        "time": "22:30:00"
      }
    }
  ],
  "medicationuse": "Regimen posology with frequency (2) - daily hours - morning / noon / afterlunch / sleep"
}
